{
  "fleet_key": "12875952878634045fcbb4e4141a8dfe0be473691a218eea3a92cfbd9f4f50e2",
  "flight_ids": [
    "flight-031",
    "flight-030",
    "flight-002",
    "flight-025",
    "flight-036",
    "flight-023",
    "flight-011",
    "flight-028",
    "flight-026",
    "flight-020",
    "flight-004",
    "flight-005",
    "flight-029",
    "flight-027",
    "flight-021",
    "flight-000",
    "flight-024",
    "flight-013",
    "flight-012",
    "flight-003",
    "flight-033",
    "flight-019",
    "flight-001",
    "flight-018",
    "flight-022",
    "flight-016",
    "flight-017",
    "flight-032",
    "flight-035",
    "flight-014",
    "flight-034",
    "flight-007",
    "flight-006",
    "flight-015",
    "flight-009",
    "flight-008",
    "flight-010"
  ],
  "excluded": [],
  "metrics": {
    "egt_spread": {
      "metric_id": "egt_spread",
      "baseline": {
        "n": 37,
        "mean": 57.79,
        "std": 4.71,
        "min": 46.6,
        "max": 67.3,
        "confidence": {
          "level": "GOOD",
          "n": 37
        }
      },
      "trend": {
        "n": 37,
        "slope": 0.12771,
        "r_squared": 0.311,
        "direction": "increasing",
        "x": "engine_hours",
        "confidence": {
          "level": "GOOD",
          "n": 37
        }
      },
      "points": [
        {
          "flight_id": "flight-031",
          "date": "2026-04-08",
          "x": 28.2,
          "value": 53.0
        },
        {
          "flight_id": "flight-030",
          "date": "2026-04-09",
          "x": 29.0,
          "value": 62.0,
          "band": "mild"
        },
        {
          "flight_id": "flight-002",
          "date": "2026-04-17",
          "x": 29.4,
          "value": 46.6,
          "band": "mild"
        },
        {
          "flight_id": "flight-025",
          "date": "2026-04-21",
          "x": 30.2,
          "value": 56.3,
          "band": "mild"
        },
        {
          "flight_id": "flight-036",
          "date": "2026-04-22",
          "x": 32.5,
          "value": 48.8
        },
        {
          "flight_id": "flight-023",
          "date": "2026-04-23",
          "x": 33.0,
          "value": 54.8
        },
        {
          "flight_id": "flight-011",
          "date": "2026-04-23",
          "x": 38.2,
          "value": 52.6
        },
        {
          "flight_id": "flight-028",
          "date": "2026-04-30",
          "x": 42.8,
          "value": 54.8,
          "band": "mild"
        },
        {
          "flight_id": "flight-026",
          "date": "2026-05-08",
          "x": 44.1,
          "value": 51.8,
          "band": "mild"
        },
        {
          "flight_id": "flight-020",
          "date": "2026-05-08",
          "x": 44.8,
          "value": 50.8
        },
        {
          "flight_id": "flight-004",
          "date": "2026-05-08",
          "x": 46.9,
          "value": 51.9,
          "band": "mild"
        },
        {
          "flight_id": "flight-005",
          "date": "2026-05-18",
          "x": 50.3,
          "value": 54.9
        },
        {
          "flight_id": "flight-029",
          "date": "2026-05-18",
          "x": 51.1,
          "value": 65.2,
          "band": "mild"
        },
        {
          "flight_id": "flight-027",
          "date": "2026-05-20",
          "x": 51.8,
          "value": 62.3,
          "band": "mild"
        },
        {
          "flight_id": "flight-021",
          "date": "2026-05-27",
          "x": 53.5,
          "value": 59.5,
          "band": "cold"
        },
        {
          "flight_id": "flight-000",
          "date": "2026-05-27",
          "x": 56.2,
          "value": 54.8,
          "band": "mild"
        },
        {
          "flight_id": "flight-024",
          "date": "2026-06-02",
          "x": 58.4,
          "value": 56.7
        },
        {
          "flight_id": "flight-013",
          "date": "2026-06-02",
          "x": 59.1,
          "value": 60.7,
          "band": "mild"
        },
        {
          "flight_id": "flight-012",
          "date": "2026-06-04",
          "x": 60.0,
          "value": 58.2,
          "band": "mild"
        },
        {
          "flight_id": "flight-003",
          "date": "2026-06-08",
          "x": 60.4,
          "value": 55.9,
          "band": "mild"
        },
        {
          "flight_id": "flight-033",
          "date": "2026-06-13",
          "x": 61.6,
          "value": 57.1
        },
        {
          "flight_id": "flight-019",
          "date": "2026-06-17",
          "x": 63.5,
          "value": 61.2,
          "band": "cold"
        },
        {
          "flight_id": "flight-001",
          "date": "2026-06-18",
          "x": 66.3,
          "value": 67.3,
          "band": "mild"
        },
        {
          "flight_id": "flight-018",
          "date": "2026-06-22",
          "x": 69.9,
          "value": 58.1,
          "band": "mild"
        },
        {
          "flight_id": "flight-022",
          "date": "2026-07-03",
          "x": 70.4,
          "value": 59.2,
          "band": "mild"
        },
        {
          "flight_id": "flight-016",
          "date": "2026-07-06",
          "x": 71.5,
          "value": 57.9,
          "band": "mild"
        },
        {
          "flight_id": "flight-017",
          "date": "2026-07-06",
          "x": 72.2,
          "value": 57.3
        },
        {
          "flight_id": "flight-032",
          "date": "2026-07-08",
          "x": 72.5,
          "value": 56.5
        },
        {
          "flight_id": "flight-035",
          "date": "2026-07-14",
          "x": 73.5,
          "value": 63.8,
          "band": "mild"
        },
        {
          "flight_id": "flight-014",
          "date": "2026-07-17",
          "x": 75.3,
          "value": 61.5,
          "band": "mild"
        },
        {
          "flight_id": "flight-034",
          "date": "2026-07-17",
          "x": 80.3,
          "value": 59.4,
          "band": "mild"
        },
        {
          "flight_id": "flight-007",
          "date": "2026-07-18",
          "x": 85.4,
          "value": 63.1,
          "band": "mild"
        },
        {
          "flight_id": "flight-006",
          "date": "2026-07-22",
          "x": 87.7,
          "value": 65.9,
          "band": "mild"
        },
        {
          "flight_id": "flight-015",
          "date": "2026-07-22",
          "x": 90.9,
          "value": 62.4,
          "band": "mild"
        },
        {
          "flight_id": "flight-009",
          "date": "2026-07-23",
          "x": 93.8,
          "value": 58.0,
          "band": "cold"
        },
        {
          "flight_id": "flight-008",
          "date": "2026-07-23",
          "x": 97.8,
          "value": 58.5,
          "band": "mild"
        },
        {
          "flight_id": "flight-010",
          "date": "2026-08-10",
          "x": 102.0,
          "value": 59.4
        }
      ],
      "outliers": [
        {
          "flight_id": "flight-002",
          "z_score": -2.37
        },
        {
          "flight_id": "flight-001",
          "z_score": 2.02
        }
      ],
      "by_band": {
        "band_kind": "oat_band",
        "bands": {
          "mild": {
            "n": 23,
            "mean": 59.03,
            "std": 4.98,
            "min": 46.6,
            "max": 67.3,
            "confidence": {
              "level": "MODERATE",
              "n": 23
            }
          },
          "cold": {
            "n": 3,
            "mean": 59.57,
            "std": 1.6,
            "min": 58.0,
            "max": 61.2,
            "confidence": {
              "level": "LOW",
              "n": 3
            }
          }
        }
      }
    },
    "egt4_elevation": {
      "metric_id": "egt4_elevation",
      "baseline": {
        "n": 37,
        "mean": 45.17,
        "std": 4.7,
        "min": 32.7,
        "max": 54.1,
        "confidence": {
          "level": "GOOD",
          "n": 37
        }
      },
      "trend": {
        "n": 37,
        "slope": 0.0578,
        "r_squared": 0.064,
        "direction": "flat",
        "x": "engine_hours",
        "confidence": {
          "level": "GOOD",
          "n": 37
        }
      },
      "points": [
        {
          "flight_id": "flight-031",
          "date": "2026-04-08",
          "x": 28.2,
          "value": 39.8
        },
        {
          "flight_id": "flight-030",
          "date": "2026-04-09",
          "x": 29.0,
          "value": 51.5,
          "band": "mild"
        },
        {
          "flight_id": "flight-002",
          "date": "2026-04-17",
          "x": 29.4,
          "value": 37.0,
          "band": "mild"
        },
        {
          "flight_id": "flight-025",
          "date": "2026-04-21",
          "x": 30.2,
          "value": 48.1,
          "band": "mild"
        },
        {
          "flight_id": "flight-036",
          "date": "2026-04-22",
          "x": 32.5,
          "value": 32.7
        },
        {
          "flight_id": "flight-023",
          "date": "2026-04-23",
          "x": 33.0,
          "value": 43.4
        },
        {
          "flight_id": "flight-011",
          "date": "2026-04-23",
          "x": 38.2,
          "value": 41.6
        },
        {
          "flight_id": "flight-028",
          "date": "2026-04-30",
          "x": 42.8,
          "value": 44.9,
          "band": "mild"
        },
        {
          "flight_id": "flight-026",
          "date": "2026-05-08",
          "x": 44.1,
          "value": 41.7,
          "band": "mild"
        },
        {
          "flight_id": "flight-020",
          "date": "2026-05-08",
          "x": 44.8,
          "value": 40.0
        },
        {
          "flight_id": "flight-004",
          "date": "2026-05-08",
          "x": 46.9,
          "value": 42.4,
          "band": "mild"
        },
        {